"Message to verify stock when the user is without login.", "Mensaje para verificar stock cuando el usuario está sin iniciar sesión."
"Add to Cart without login", "Agregar al carrito sin iniciar sesión"
"Use Almacen for stock", "Usa Almacén para stock"
"Please log in to your account to check availability and prices",""Favor de ingresar a su cuenta para verificar disponibilidad y precios"
"Show Price without login","Mostrar precio sin iniciar sesión"
"Show Add to Cart without login","Mostrar Agregar al carrito sin iniciar sesión"
